{
  "scope": "dealer",
  "filters": [
    "make",
    "model",
    "trim",
    "condition",
    "vehicle_type",
    "transmission",
    "fuel",
    "electric_range_mi_min",
    "electric_range_mi_max",
    "dc_fast_charge",
    "charge_port",
    "driveline",
    "body",
    "displacement_cc_min",
    "displacement_cc_max",
    "exterior_color",
    "interior_color",
    "rooftops",
    "status",
    "features_all",
    "features_any",
    "near",
    "year_min",
    "year_max",
    "price_min",
    "price_max",
    "mileage_max",
    "vin",
    "stock",
    "query"
  ],
  "sort_fields": [
    "price",
    "list_price",
    "msrp",
    "mileage",
    "year",
    "make",
    "model",
    "stock",
    "updated_at",
    "distance_mi"
  ],
  "default_sort": {
    "field": "price",
    "order": "asc"
  },
  "default_limit": 20,
  "max_limit": 100,
  "offset": true
}
